{
  "schema": "icecream-distribution-suite-v1",
  "name": "firefox-corrected-shared-uplink-f-width",
  "scenarios": [
    "scenarios/firefox-c1f1-200b1g.json",
    "scenarios/firefox-c1f2-200b1g.json",
    "scenarios/firefox-c1f3-200b1g.json",
    "scenarios/firefox-c1f4-200b1g.json",
    "scenarios/firefox-c1f20-200b1g.json"
  ],
  "diagnostic_codecs": ["compile-only", "raw"]
}
